{
  "route_id": "ROUTE-TEST",
  "decision_id": "DECISION-TEST",
  "decision": "EVIDENCE_INSUFFICIENT",
  "audit_result": "PASS",
  "current_phase": "PHASE-AUTOMATED-EVIDENCE-SUFFICIENCY-002C",
  "next_phase_allowed": "PHASE-EVIDENCE-EXPANSION-002D",
  "phase003_allowed": false,
  "evidence_expansion_allowed": true,
  "phase002d_started": false,
  "reason_codes": ["INSUFFICIENT_ROUTES_TO_EXPANSION"],
  "route_hash": "0000000000000000000000000000000000000000000000000000000000000000"
}
